Text_lang,Text1_lang,ID,LanguageID,ConditionID,EmotesID,Flags,ChatBubbleDurationMs,VoiceOverPriorityID,SoundKitID[0],SoundKitID[1],EmoteID[0],EmoteID[1],EmoteID[2],EmoteDelay[0],EmoteDelay[1],EmoteDelay[2]
How may I help you?,How may I help you?,30864,0,0,0,1,0,0,0,0,396,0,0,0,0,0
"Cooking for the King is an honor, not a job.  Do you have time to help me on some errands?","Cooking for the King is an honor, not a job.  Do you have time to help me on some errands?",42232,7,0,0,1,0,0,0,0,0,0,0,0,0,0
"Best deals in all of Stormwind my friend, won't find any better. Now, what can I help you with?","Best deals in all of Stormwind my friend, won't find any better. Now, what can I help you with?",3377,7,0,0,1,0,0,0,0,0,0,0,0,0,0
"Please feel free to browse the items up for bid, or if you would like to list an item, I can help.",,52634,0,0,0,1,0,0,0,0,1,273,0,0,0,0
"Welcome to my Inn, weary traveler. What can I do for you?","Welcome to my Inn, weary traveler. What can I do for you?",2821,7,0,0,1,0,0,0,0,0,0,0,0,0,0
"Best deals in all of Stormwind my friend, won't find any better. Now, what can I help you with?","Best deals in all of Stormwind my friend, won't find any better. Now, what can I help you with?",3383,7,0,0,1,0,0,0,0,0,0,0,0,0,0
No one's ever stolen anything out of here. Not in the whole history of... the whole history!,No one's ever stolen anything out of here. Not in the whole history of... the whole history!,3397,7,0,0,1,0,0,0,0,0,0,0,0,0,0
"Exactly. I ran some tests on the residual digestive fluid coating my suit and...

<Pip trails off>

Say, you haven't seen my skinning knife anywhere, have you? I seem to have misplaced it.",,44572,0,0,0,1,0,4,0,0,0,0,0,0,0,0
