Text_lang,Text1_lang,ID,LanguageID,ConditionID,EmotesID,Flags,ChatBubbleDurationMs,VoiceOverPriorityID,SoundKitID[0],SoundKitID[1],EmoteID[0],EmoteID[1],EmoteID[2],EmoteDelay[0],EmoteDelay[1],EmoteDelay[2]
The Valley of Trials will temper even the weakest into a warrior worthy to join the Horde. Those who cannot rise to its tests will be left to bake in the scorching desert sun.,,6016,0,0,0,1,0,0,0,0,0,0,0,0,0,0
"What kin I do for ya, mon?","What kin I do for ya, mon?",7633,0,0,0,1,0,0,0,0,0,0,0,0,0,0
I don't train your kind $c.  Find your own trainer before you anger me.,I don't train your kind $c.  Find your own trainer before you anger me.,7631,0,0,0,1,0,0,0,0,0,0,0,0,0,0
I don't train your kind $c.,I don't train your kind $c.,7476,0,0,0,1,0,0,0,0,0,0,0,0,0,0
If we are to make these new lands ours then we must have places to rest our battle weary bodies. Lay your axe by the fire and share the stories of your mighty battles.,If we are to make these new lands ours then we must have places to rest our battle weary bodies. Lay your axe by the fire and share the stories of your mighty battles.,3003,1,0,0,1,0,0,0,0,0,0,0,0,0,0
What are you looking for?,What are you looking for?,6630,1,0,0,1,0,0,0,0,0,0,0,0,0,0
Which trainer do you seek?,Which trainer do you seek?,6602,1,0,0,1,0,0,0,0,0,0,0,0,0,0
The Hunter Trainer's name is Thotar.  Seek him out inside the burrow on the southwest corner of Razor Hill.,The Hunter Trainer's name is Thotar.  Seek him out inside the burrow on the southwest corner of Razor Hill.,6556,1,0,0,1,0,0,0,0,0,0,0,0,0,0
I train and guide young hunters in the traditions passed down many generations.,,7529,0,0,0,1,0,0,0,0,0,0,0,0,0,0
