Text_lang,Text1_lang,ID,LanguageID,ConditionID,EmotesID,Flags,ChatBubbleDurationMs,VoiceOverPriorityID,SoundKitID[0],SoundKitID[1],EmoteID[0],EmoteID[1],EmoteID[2],EmoteDelay[0],EmoteDelay[1],EmoteDelay[2]
Rest your weary bones for a spell.,Rest your weary bones for a spell.,2824,1,0,0,1,0,0,0,0,0,0,0,0,0,0
,"$n, my favorite supplier! How can I help you today?",252273,0,0,0,0,0,4,0,0,0,0,0,0,0,0
"All of our collections are completed, $c. That which we have assembled is in the process of being transported to Cenarion Hold in Silithus, and the last of it should take no more than a day to arrive. The Ahn'Qiraj War can then start once that is done and someone brave and foolish rings the gong right outside of the gates down there.",,11241,0,0,0,1,0,0,0,0,1,1,0,0,0,0
"Greetings, $c - I'm a Commendation Officer acting on behalf of Orgrimmar.  It is my duty to assist adventurers who have received Horde Commendation Signets.$B$BI accept signets in different quantities, but the most beneficial exchange for you is to hand in a set of ten at once.  I will enter your deeds into our records when you hand in your signets.  As a result, you will earn recognition from Orgrimmar for your duty and service.
","Greetings, $c - I'm a Commendation Officer acting on behalf of Orgrimmar.  It is my duty to assist adventurers who have received Horde Commendation Signets.$B$BI accept signets in different quantities, but the most beneficial exchange for you is to hand in a set of ten at once.  I will enter your deeds into our records when you hand in your signets.  As a result, you will earn recognition from Orgrimmar for your duty and service.

",11419,0,0,0,1,0,0,0,0,66,1,0,0,0,0
"Lookin' for repairs? A new helmet?

Whatever it is, I got you covered.",,286571,0,0,0,256,0,4,0,0,0,0,0,0,0,0
