Name_lang,Description_lang,Map[0],Map[1],ID,JournalInstanceID,DungeonEncounterID,OrderIndex,FirstSectionID,UiMapID,MapDisplayConditionID,Flags,DifficultyMask
Glubtok,"In a fit of rage, Glubtok unleashed his potent magical abilities and reduced his ogre mound to ash. Upon hearing of his destructive talents, the Defias hired the massive ogre mage to supervise their laborers as head foreman of the Deadmines.",0.3652697,0.6122755,89,63,1064,1,2010,291,0,0,-1
Helix Gearbreaker,"Formerly a craftsman in the Bilgewater Cartel, Helix was offered a sum eclipsing anything he would ever make as a nameless Horde engineer to ply his trade for the Defias Brotherhood. He was quick to accept the job and renounce his former loyalties... just as any resourceful goblin would.",0.50199604,0.8682636,90,63,1065,2,2020,291,0,0,-1
Foe Reaper 5000,"Defias engineers have spent many long days perfecting a new harvester model based on the Foe Reaper 4000 unit. Once it is completed, the brotherhood believes this mechanized terror will be able to slice through Stormwind's armored soldiers like a scythe through wheat.",0.12475067,0.75898206,91,63,1063,3,3448,292,0,0,-1
Admiral Ripsnarl,"When James Harrington became afflicted by the worgen curse, he destroyed his loving family and maritime career in one chilling night of bloodlust. Taking on the name Ripsnarl, he fled into Westfall and later agreed to command the Defias Brotherhood's fearsome juggernaut.",0.60479087,0.38772452,92,63,1062,4,2044,292,0,0,-1
"""Captain"" Cookie","Cookie proclaimed himself captain of the Defias Brotherhood's juggernaut following its previous commander's death. Although he still performs his official duties as chief cook, anyone who questions the validity of his captain title has been known to come down with a severe case of food poisoning.",0.60479087,0.4550898,93,63,1060,5,2055,292,0,0,-1
Vanessa VanCleef,"As a young girl, Vanessa witnessed the gruesome death of her father and former Defias Brotherhood leader, Edwin VanCleef. She has since taken up his mantle of leadership, plotting to exact vengeance on Stormwind from the dark corridors of the Defias's stronghold in the Deadmines.",0.6546913,0.40269458,95,63,1081,6,2060,292,0,2,-2
Baron Ashbury,"Slain by worgen and raised into undeath by the Forsaken, the traitor Baron Ashbury toys with his foes, keeping them alive so he can inflict maximum pain and suffering.",0.66467136,0.732036,96,64,1069,1,2107,310,0,0,-1
Baron Silverlaine,Baron Silverlaine was master of the keep before it fell to Arugal's worgen. Now his cursed spirit calls upon the very wolf-beasts that slaughtered him to punish further trespassers into his home.,0.30439156,0.7739521,97,64,1070,2,2118,311,0,0,-1
Commander Springvale,"A loyal soldier, the ghost of Commander Springvale haunts the council room, using unholy strikes to avenge his lord, Baron Silverlaine.",0.2804395,0.5973054,98,64,1071,3,2137,310,0,0,-1
Lord Walden,"Godfrey's right-hand man, the arrogant Lord Walden vowed to pay any price, including death, to serve his compatriot. Now among the undead, Walden intends to keep his word, attacking adversaries with ice and venom.",0.5449104,0.53742516,99,64,1073,4,2156,313,0,0,-1
Lord Godfrey,"Drawing from his past as a Gilnean noble and Forsaken agent, the cunning and resourceful Lord Godfrey wields dual pistols and commands relentless flesh-eating ghouls.",0.6846315,0.3353293,100,64,1072,5,2164,315,0,0,-1
Lady Naz'jar,"Lady Naz'jar played a pivotal role in retaking Vashj'ir from the brutal Kvaldir, earning her Queen Azshara's favor. Recently Naz'jar spearheaded an assault against Neptulon and succeeded in cornering the powerful elemental lord within his throne room.",0.50499004,0.21556878,101,65,1045,1,2179,323,0,0,-1
"Commander Ulthok, the Festering Prince","Ulthok is an incredibly ancient being sent by his Old God masters to aid Lady Naz'jar with invading the Throne of Tides. Bristling with sinister powers, Ulthok commands legions of his fellow faceless ones in the deepest trenches surrounding Vashj'ir.",0.50499004,0.42514968,102,65,1044,2,2189,323,0,0,-1
Mindbender Ghur'sha,"After his valiant efforts at the Abyssal Breach, Earthen Ring shaman Erunak Stonespeaker was abducted by naga forces and enslaved by Mindbender Ghur'sha. It is feared that this parasitic aberration has taken full control over Erunak's mind, body, and devastating shamanic abilities.",0.67465144,0.19311368,103,65,1046,3,2194,322,0,0,-1
Ozumat,"Tales of the monstrous kraken that terrorize Azeroth's high seas were once relegated to myth... but no longer. By some ill means, the naga have bent Ozumat-the patriarch of all kraken-to their will and unleashed him against Neptulon and his followers.",0.3253496,0.19311368,104,65,1047,4,2204,322,0,0,-1
Rom'ogg Bonecrusher,"One of the rare ""missing link"" ogres on Outland, Rom'ogg Bonecrusher piqued the Twilight's Hammer Cult's interest with his merciless treatment of the ogres. He now lords over the Chamber of Incineration, sating his hunger for inflicting torment on others.",0.5,0.70209587,105,66,1040,1,2356,283,0,0,-1
"Corla, Herald of Twilight","Formerly an accomplished Kirin Tor mage, Corla now serves the Twilight's Hammer with unwavering devotion. She blesses fellow zealots by harnessing nether dragon essences to transform these believers into menacing twilight drakonid.",0.27045947,0.16317356,106,66,1038,2,2361,284,0,0,-1
Karsh Steelbender,"The enormous drakonid Karsh Steelbender toils in the Twilight Forge, shaping weapons of war out of rare quicksilver. Although Karsh's works are nearly unbreakable under normal circumstances, at high temperatures they become as brittle as rusted iron.",0.47005993,0.6646707,107,66,1039,3,2371,284,0,0,-1
Beauty,"Beauty's past is a tale as old as time, a song as old as rhyme. After Beauty's mate, Beast, was slain by heroes in Blackrock Spire, the hound and its four remaining pups joined forces with the Twilight's Hammer, intent on punishing the creatures who killed its mate.",0.66467136,0.8443115,108,66,1037,4,2378,284,0,0,-1
Ascendant Lord Obsidius,"For his unyielding devotion and penchant for cruelty, the powerful shaman Dessirik the Depraved was gifted with ascension: a dark ritual that infused him with elemental powers, transforming him into a monstrosity known as Ascendant Lord Obsidius.",0.68962157,0.50748503,109,66,1036,5,2385,284,0,0,-1
Corborus,"Deathwing enslaved the massive gyreworm Corborus and drove it to unearth the vast amounts of elementium required to forge the Dragon Aspect's new plating. With Deathwing's departure, however, Corborus has broken loose and now rampages through the Stonecore in blind fury.",0.6297411,0.5973054,110,67,1056,1,2394,324,0,0,-1
Slabhide,"With his powers as the Aspect of Earth amplified by the Old Gods, Deathwing easily swayed Deepholm's stone wyrms into serving the Twilight's Hammer. One of the most ambitious of these creatures, Slabhide hopes to earn Deathwing's favor by exterminating any intruders brazen enough to enter the Stonecore.",0.3702597,0.44760478,111,67,1059,2,2401,324,0,0,-1
Ozruk,"Ozruk has served as Stonecore's guardian since Deepholm's creation. It is unknown why Ozruk has remained in the Stonecore, but it has become apparent that the guardian now believes that anyone opposed to Deathwing is a threat to Deepholm, and should therefore be destroyed.",0.50499004,0.23053885,112,67,1058,3,2405,324,0,0,-1
High Priestess Azil,"High Priestess Azil is one of the few who has survived communing with the Twilight's Hammer cult's eldritch masters, although little remains of her sanity. She instills terror in lesser cultists so that they will sacrifice themselves without hesitation when their masters command it.",0.5748506,0.38772452,113,67,1057,4,2411,324,0,0,-1
Grand Vizier Ertan,"Ertan defends the Vortex Pinnacle under the command of her master, Asaad, against any ground-dwellers who dare intrude on the realm. To fulfill her duties, the elemental noble has been granted mastery over the primal forces of lightning and wind.",0.5499004,0.44760478,114,68,1043,1,2419,325,0,0,-1
Altairus,"The immense storm wyrm Altairus maintains an unyielding vigil over the hovering platforms of the Vortex Pinnacle. The very energies of the storms pulse through this being, and he is said to command the wind currents that buffet the elemental fortress.",0.51996017,0.8218564,115,68,1041,2,2425,325,0,0,-1
"Asaad, Caliph of Zephyrs","The fearsome elemental Asaad was named guardian of the Vortex Pinnacle by Al'Akir himself. With Siamat, Lord of the South Wind, imprisoned by the Neferset tol'vir, Asaad believes he may ascend to the Conclave of Wind if he performs his duties well.",0.30039954,0.3802395,116,68,1042,3,2431,325,0,0,-1
General Husam,"The titans themselves appointed General Husam as one of Uldum's foremost guardians. After Siamat, Lord of the South Wind, cured the Neferset tol'vir's curse of flesh, Husam helmed a rebellion that culminated in the air elemental's imprisonment.",0.3752497,0.42514968,117,69,1052,1,2437,277,0,0,-1
Lockmaw,"Amid the Neferset's chaotic insurrection against Siamat, the pygmy Augh pilfered whatever treasures he could from the ancient tol'vir city. Among his race, Augh is respected as much for his cunning as he is for his ferocious pet crocolisk, Lockmaw.",0.67465144,0.72455096,118,69,1053,2,2442,277,0,0,-1
High Prophet Barim,"High Prophet Barim is the hallowed spiritual leader of the Neferset. Along with General Husam, he rallied his fellow Neferset against Siamat and imprisoned the air elemental. Regardless, some dark force still drives Barim and his followers to terrorize Uldum.",0.27045947,0.6571857,119,69,1054,3,2455,277,0,0,-1
Siamat,Purging the Neferset tol'vir's curse of flesh left the fearsome elemental Siamat severely drained. It was during this moment of vulnerability that the tol'vir struck and magically imprisoned Siamat at the center of their ancient sand-swept city.,0.4151698,0.5523952,122,69,1055,4,2474,277,0,0,-1
Temple Guardian Anhuur,"In the final days of the Halls of Origination's use by titanic forces, Temple Guardian Anhuur was endowed with the willpower needed to wield the Light. Thus empowered, he was charged with judging the purity of those entering the facility.",0.5848307,0.62724555,124,70,1080,1,2489,297,0,0,-1
Earthrager Ptah,"Outside Earthrager Ptah's tomb, the sand is littered with the bones of creatures purified by Anhuur. It is said that Ptah can bend these remains to his will and send them against beings who manage to elude the facility's first line of defense.",0.5,0.49251497,125,70,1076,2,2540,298,0,0,-1
Anraphet,"The Anraphet maintenance unit was created to man the inner workings of the Halls of Origination. In the event that the facility is contaminated by foreign entities, Anraphet will access programs designed to annihilate the intruders by any means necessary.",0.5598805,0.14071846,126,70,1075,3,2551,297,0,0,-1
"Isiset, Construct of Magic","Isiset serves to regulate the arcane energies contained within, and produced by, the Halls of Origination. Legend has it that this construct has become enraptured with her own arcane mastery and the perfection with which it seemingly endows her.",0.31037956,0.5,127,70,1077,4,2555,299,0,0,-1
"Ammunae, Construct of Life","Although designed to reduce Azeroth to its base elements, the reordering system inside the Halls of Origination also creates new life. To that end, the construct Ammunae regulates the natural energies coursing through the facility to ensure that life will exist on a reforged Azeroth.",0.47504994,0.74700606,128,70,1074,5,2565,299,0,0,-1
"Setesh, Construct of Destruction","Given the purpose of the Halls of Origination, the titans deemed it necessary to create Setesh, a construct who holds sway over the powers of destruction. Should Setesh ever fall to corruption, the results would be disastrous.",0.63972116,0.49251497,129,70,1079,6,2666,299,0,0,-1
"Rajh, Construct of Sun","Rajh oversees the energies that have both sparked life and snuffed it out in an untold number of his kin. Considered the mightiest of his fellow constructs, Rajh holds the power to unleash the fury of a thousand suns upon Azeroth.",0.47504994,0.25299394,130,70,1078,7,2926,299,0,0,-1
General Umbriss,"As Azeroth's champions and their red dragon allies assault the gates of Grim Batol, the malefic General Umbriss leads the fortress's cultist and twilight dragonspawn defenders.",0.40518978,0.6871258,131,71,1051,1,3353,293,0,0,-1
Forgemaster Throngus,"A smith for the Twilight's Hammer cult, this massive ettin is eager to use the weapons and armor he's forged to annihilate intruders.",0.515,0.3,132,71,1050,2,816,293,0,0,-1
Drahga Shadowburner,"This Twilight's Hammer courier is on a mission from the Bastion of Twilight. Should heroes overcome his fiery minions, Drahga will reveal a portent of doom for Azeroth's defenders.",0.6946116,0.19311368,133,71,1048,3,3364,293,0,0,-1
"Erudax, the Duke of Below","Deathwing has dispatched one of his greatest lieutenants to discover the secret that several mighty red dragons have died to protect. From the cavernous realm of Deepholm, this faceless general will bring to bear the next generation of draconic power to obliterate those foolish enough to challenge him.",0.8562618,0.74700606,134,71,1049,4,3374,293,0,0,-1
Argaloth,"Unable to contain the massive pit lord Argaloth in the cells of Dalaran's mighty Violet Hold, the magi of the Kirin Tor were left with no choice but to confine the powerful demon beneath Tol Barad.",0.8043925,0.6347306,139,75,1033,1,2602,282,0,2,-17
Occu'thar,"This ravenous demon broke free of its cage and gained access to the western wing of the prison, devouring all of the inmates held there. Occu'thar's gluttony resulted in a body too bloated to escape its environs, effectively turning the prison wing into its new holding cell.",0.15568893,0.6317773,140,75,1250,2,2605,282,0,2,-17
The Conclave of Wind,"With Siamat, Lord of the South Wind, imprisoned by the Neferset tol'vir, Al'Akir's lieutenants are vying to fill the power vacuum that now exists in the Conclave of Wind. The remaining conclave members are Anshal, Lord of the West Wind, whose gales can heal allies or poison enemies; Rohash, Lord of the East Wind, whose tempests can grind the mightiest mountains to dust; and Nezir, Lord of the North Wind, whose frigid storms have claimed more lives than all other cardinal wind lords combined.",0.47504994,0.26047897,154,74,1035,1,3166,328,0,2,15
Al'Akir,"Gifted with great intelligence and cunning, Al'Akir the Windlord once served as the foremost tactician in the Old Gods' horrific armies. In the wake of the Cataclysm, he has aligned with Deathwing and turned his godlike powers against many of the air elementals' ancient tol'vir nemeses.",0.47504994,0.5,155,74,1034,2,3021,328,0,2,15
Halfus Wyrmbreaker,"Imbued with unnatural power and stamina by Cho'gall, the ettin Halfus Wyrmbreaker captures dragons for use as fodder in the Twilight's Hammer's rituals. To this end, he has enslaved a behemoth proto-dragon to aid him in hunting down his winged prey.",0.5349303,0.19311368,156,72,1030,1,2959,294,0,2,-17
Theralion and Valiona,"Magically aged to adulthood, Valiona and Theralion were to be paragons among a new clutch of twilight dragons, leading their brood in scouring Azeroth of life. Instead, they waste their incredible powers constantly bickering and fighting each other.",0.53992033,0.7844312,157,72,1032,2,2994,294,0,2,-17
Ascendant Council,"As the most powerful Twilight's Hammer cultists to be twisted into elemental beings, the Ascendant Council members have long forgotten their existence as mere mortals. From their wicked sanctum, they oversee the selection of new ascension candidates.",0.42514983,0.4550898,158,72,1028,3,3109,295,0,2,-17
Cho'gall,"Under Cho'gall's control, the orcish Twilight's Hammer clan was transformed into a murderous cult obsessed with the Old Gods and their herald, Deathwing. Extended contact with his dark master has hideously warped both Cho'gall's mind and body.",0.73453194,0.7544911,167,72,1029,4,3165,295,0,2,-17
Sinestra,"Originally Deathwing's prime consort, Sinestra created the first twilight dragons, but was later obliterated by one of her terrifying creations. Now a ravaged husk reanimated by insidious magic, Sinestra oversees the creation of new twilight clutches.",0.49001998,0.34281433,168,72,1082,5,3226,296,0,2,-20
Omnotron Defense System,"The Omnotron Defense System was once touted as the Dark Iron dwarves' greatest technological marvel. When Nefarian arrived in Blackwing Descent, he repurposed the run-down system to annihilate anyone intruding on his laboratories.",0.6546913,0.5748503,169,73,1027,1,3193,285,0,2,-17
Magmaw,"Magmaw is a colossal lava worm summoned from the Firelands centuries ago by Ragnaros' Dark Iron servitors. Nefarian largely considers Magmaw a worrisome pest, but has grown fond of feeding the beast his failed experiments... and servants.",0.27544948,0.5748503,170,73,1024,2,3310,285,0,2,15
Atramedes,"Atramedes, or Experiment 25463-D, is a failed attempt to bestow enhanced senses on a black dragon whelp. The toxic salve applied to the broodling robbed him of sight, forcing him to rely on sound and smell for survival. A tragic story... if Atramedes weren't so evil.",0.47504994,0.32784426,171,73,1022,3,3072,286,0,2,-17
Chimaeron,Terrifying. Ugly. Evil. Kill it.,0.2455094,0.70209587,172,73,1023,4,3008,286,0,2,-17
Maloriak,The human Malory was a bright young alchemist until he was kidnapped by Nefarian and fused with the corpse of a dragonspawn. The result-Maloriak-is a bumbling minion who possesses only a dull glimmer of his former intelligence.,0.7145718,0.70209587,173,73,1025,5,2929,286,0,2,-17
Nefarian's End,"Deathwing's son, Nefarian, gained infamy for his horrifying efforts to create chromatic dragons from the essences of Azeroth's various dragonflights. After his death in Blackwing Lair, he was reanimated and charged by Deathwing to continue his insidious endeavors.",0.48003995,0.70209587,174,73,1026,6,3276,286,0,2,-17
High Priest Venoxis,"Originally sent to kill Hakkar, Venoxis became enslaved to the murderous entity before falling to Azeroth's heroes. Through the efforts of the Soulflayer's agents, Venoxis has been ripped from the spirit world and ordered to defend Zul'Gurub with his venomous serpentine minions.",0.5099801,0.53742516,175,76,1178,1,2787,337,0,0,-1
Bloodlord Mandokir,"The infamous Bloodlord Mandokir died a torturous death before Bloodscalp trolls desecrated his body years ago. Word has now spread that Mandokir walks the jungles of Stranglethorn yet again, using the corpse of the mighty Bloodscalp chieftain Gan'zulah as a host for his malevolent spirit.",0.60479087,0.7994013,176,76,1179,2,2610,337,0,0,-1
Cache of Madness - Gri'lek,"Among the hateful spirits in the Cache of Madness are Gri'lek, a dire troll stripped of his regenerative abilities by the loa; Renataki, an infamous and sadistic warrior; Hazza'rah, a seer tormented by dire future visions; and Wushoolay, a mighty combatant bristling with the powers of the storms.",0.5998008,0.46257484,177,76,788,3,2504,337,0,0,-1
Cache of Madness - Hazza'rah,"Among the hateful spirits in the Cache of Madness are Gri'lek, a dire troll stripped of his regenerative abilities by the loa; Renataki, an infamous and sadistic warrior; Hazza'rah, a seer tormented by dire future visions; and Wushoolay, a mighty combatant bristling with the powers of the storms.",0.6367,0.46257484,178,76,788,4,3508,337,0,0,-1
Cache of Madness - Renataki,"Among the hateful spirits in the Cache of Madness are Gri'lek, a dire troll stripped of his regenerative abilities by the loa; Renataki, an infamous and sadistic warrior; Hazza'rah, a seer tormented by dire future visions; and Wushoolay, a mighty combatant bristling with the powers of the storms.",0.5998008,0.51497006,179,76,788,5,2501,337,0,0,-1
Cache of Madness - Wushoolay,"Among the hateful spirits in the Cache of Madness are Gri'lek, a dire troll stripped of his regenerative abilities by the loa; Renataki, an infamous and sadistic warrior; Hazza'rah, a seer tormented by dire future visions; and Wushoolay, a mighty combatant bristling with the powers of the storms.",0.6019053,0.41471136,180,76,788,6,2498,337,0,0,-1
High Priestess Kilnara,"When High Priestess Arlokk was killed, the panther loa Bethekk chose her sister, Kilnara, as her new mortal champion. Supporting the recent pact between the Gurubashi and Zandalar tribes, Kilnara has unleashed her savage panther minions on the region's unsuspecting denizens.",0.48003995,0.20059872,181,76,1180,7,2692,337,0,0,-1
Zanzil,"Exiled from the Skullsplitter tribe for turning his fellow trolls into mindless slaves, Zanzil was recently offered a place among the Gurubashi by Jin'do the Godbreaker in exchange for bolstering Zul'Gurub's forces. It is well-known that his toxic elixirs can even rouse the dead from their graves.",0.31733844,0.24550891,184,76,1181,8,2508,337,0,0,-1
Jin'do the Godbreaker,"After his defeat in Zul'Gurub, Jin'do's spirit was tormented by his failure to serve Hakkar's wishes. Jin'do recently found a way back into the world and enslaved the Soulflayer. Bristling with the dread god's terrible powers, Jin'do plans to restore the Gurubashi empire to its former glory.",0.48502997,0.39520955,185,76,1182,9,2899,337,0,0,-1
Akil'zon,"As a former shaman of the Amani tribe, Akil'zon had a preternatural ability when working with the element of air. This talent caught the eye of Hex Lord Malacrass and made finding a host for the trolls' eagle god an easy task.",0.35528967,0.23053885,186,77,1189,1,2521,333,0,0,-1
Nalorakk,Hex Lord Malacrass considered Nalorakk-renowned for both his fearsome rage and savage strength on the battlefield-the ideal vessel for the bear god's essence.,0.40518978,0.7739929,187,77,1190,2,2867,333,0,0,-1
Jan'alai,"Dragonhawks are deft predators that rend their foes with razor-sharp talons. This mindset and method of attack were also favored by one of the Amani tribe's highly skilled rogues, Jan'alai.",0.55489045,0.7095809,188,77,1191,3,2621,333,0,0,-1
Halazzi,The lynxes of Azeroth are vicious hunters that shred their prey with fang and claw. Hex Lord Malacrass mused that it was only right to seal the essence of the lynx god within one of the tribe's greatest hunters.,0.5848307,0.23802388,189,77,1192,4,2804,333,0,0,-1
Hex Lord Malacrass,"Rumored to be the most feared witch doctor of the Amani tribe in decades, Hex Lord Malacrass has done the unthinkable and sealed the essence of several mighty troll animal gods in their strongest champions... keeping the darkest one for himself.",0.7145718,0.5299401,190,77,1193,5,2706,333,0,0,-1
Daakara,"To fill the power vacuum left from the death of their old warlord, Zul'jin, the remaining trolls of the Amani tribe chose their favored champion, Daakara the Invincible, to reclaim their lost glory.",0.90419334,0.5299401,191,77,1194,6,2875,333,0,0,-1
Beth'tilac,"Matriarch of the Cinderweb Brood, Beth'tilac and her merciless offspring sate their appetites by sucking the magma and fire from the corpses of elementals. To provide her broodlings with added sustenance, Beth'tilac has woven a network of incendiary webs throughout her lair to trap unsuspecting prey.",0.21057922,0.32784426,192,78,1197,1,2764,367,0,2,-17
Lord Rhyolith,"Rhyolith is one of the most ancient elementals in existence, born from the primordial fires that forged Azeroth itself. He is responsible for the creation of new elementals in the Firelands and still possesses a searing hatred of the titans for what he considers monumental arrogance in relocating him.",0.65369326,0.7500001,193,78,1204,2,2526,367,0,2,-17
Alysrazor,"When Ragnaros's forces surged into Mount Hyjal, the green dragon Alysra betrayed her allies and helped liberate the traitorous archdruid Fandral Staghelm. As a reward, she was purified with fire and reborn as a fearsome fire hawk.",0.6437137,0.38023955,194,78,1205,3,2824,367,0,2,-17
Shannox,"The flamewakers are among the most feared elemental guardians in the Firelands.  Shannox is no exception.  Serving as the chief hunter and kennel master of Ragnaros's hell hounds, Shannox patrols the elemental realm with his two most ferocious beasts: Riplimb and Rageface.",0.49301347,0.44311342,195,78,1206,4,2575,367,0,2,-17
"Baleroc, the Gatekeeper","Baleroc earned a reputation as a merciless combatant during the elemental wars of ancient Azeroth. Now that he is confined to the Firelands, Baleroc's sanity has dwindled. Few elementals dare disturb him, fearful that they will become victim to his battle lust.",0.4950096,0.3098805,196,78,1200,5,2590,367,0,2,-17
Majordomo Staghelm,"The loss of his son, Valstann, in the War of the Shifting Sands utterly shattered Fandral Staghelm's spirit. Now empowered by Ragnaros as the new Majordomo of the Firelands (replacing the deceased Majordomo Executus) and the leader of the treacherous Druids of the Flame, Fandral seeks to bring ruin to Azeroth rather than live in a world without his beloved child.",0.5099801,0.72455096,197,78,1185,6,2911,369,0,2,-17
Ragnaros,"Ragnaros, lord of the Firelands, embodies the fury and destruction of the primordial infernos that forged Azeroth itself. Promised the chance to set Azeroth aflame without interference from Neptulon and Therazane, Ragnaros seeks to appease the Old Gods by incinerating the World Tree of Nordrassil.",0.5099801,0.15568852,198,78,1203,7,2629,369,0,2,-17
Echo of Tyrande,"Once the leader of the night elves and High Priestess of Elune, this time-twisted fragment of Tyrande Whisperwind now wanders the wastes of the desolate future of Azeroth. Enveloped in a perpetual midnight, she has all but lost sight of the comforting light of Elune.",0.515514,0.433775,283,184,1268,4,3667,405,0,0,-1
